{
  "$schema": "./config.schema.json",
  "version": 1,
  "site": {
    "title": { "zh": "GitHub 收藏图库", "en": "GitHub Stars Gallery" },
    "subtitle": { "zh": "一眼看懂、按类浏览任何人的 Star", "en": "Anyone's GitHub stars, explained and categorized" },
    "logo": "★",
    "sourceUrl": "https://github.com/godfay-g/github-stars-gallery"
  },
  "defaultUser": "",
  "exampleUser": "yyx990803",
  "accentColor": "#6ea8fe",
  "hidePatInput": false,
  "basePath": "",
  "defaults": {
    "lang": "auto",
    "theme": "dark",
    "view": "map",
    "sort": "starred_at",
    "motion": "standard",
    "density": "comfortable",
    "maxNodesPerCategory": 150
  },
  "categoriesMode": "merge",
  "categories": []
}
